{
  "compatibilityResultSchemaVersion": "alto9.io/compatibility-result/v1alpha1",
  "fixtureId": "ex-missing-required-metadata",
  "packName": "compatibility-fixture-pack",
  "packVersion": "0.0.1-fixture",
  "compatible": false,
  "failureReasons": [
    "missing required field: compatibility"
  ]
}
